{
  "schema_version": "n5-d5-l2b-describe-authorization-1.0",
  "record_kind": "PRIVATE_DESCRIBE_ONLY_ONE_TIME_AUTHORIZATION",
  "authorization_id": "replace_describe_authorization_id",
  "one_time_nonce": "0000000000000000000000000000000000000000000000000000000000000000",
  "human_approved": true,
  "foundation_report": {
    "relative_path": "private_library/n5_d5_control/REPLACE_ME/l2a-foundation.json",
    "sha256": "0000000000000000000000000000000000000000000000000000000000000000"
  },
  "replay_plan": {
    "relative_path": "private_library/n5_d5_control/REPLACE_ME/replay-plan.json",
    "sha256": "0000000000000000000000000000000000000000000000000000000000000000"
  },
  "describe_entrypoint": {
    "inventory_relative_path": "private_library/n5_d5_bundles/REPLACE_ME/describe_adapter.py",
    "interpreter": "/usr/bin/python3",
    "standard_library_only": true,
    "arguments": []
  },
  "expected_descriptor": {
    "schema": "n5-d5-describe-descriptor-1.0",
    "adapter_id": "replace_adapter_id",
    "adapter_version": "replace-v1",
    "implementation_sha256": "0000000000000000000000000000000000000000000000000000000000000000",
    "context_id": "replace_context_id",
    "capability_profile": {
      "path_roles": [
        "curved",
        "straight"
      ],
      "native_direct_residual": false,
      "forward_supported": true,
      "jvp_supported": true,
      "vjp_supported": true
    },
    "claim_boundary": {
      "external_describe_requests_only": true,
      "internal_operation_absence_proven": false,
      "real_bost_authorized": false,
      "physical_correctness_authorized": false
    }
  },
  "output_directory": "private_library/n5_d5_runs/REPLACE_ME/l2b-describe-001",
  "scope": {
    "operations": [
      "describe"
    ],
    "external_request_count": 2,
    "auto_chain_primary": false,
    "internal_operation_absence_claimed": false
  },
  "limits": {
    "wall_timeout_seconds": 5,
    "cpu_seconds": 3,
    "stdout_bytes": 262144,
    "stderr_bytes": 8192,
    "open_files": 16,
    "processes": 1
  },
  "claim_authorizations": {
    "real_bost_interface": false,
    "physical_forward_correctness": false,
    "derivative_correctness": false,
    "reconstruction": false,
    "algorithm_superiority": false,
    "generalization": false,
    "publication": false
  }
}
